{
  "schemaVersion": "1.0.0",
  "id": "scroll-settle",
  "flowId": "scroll-settle",
  "description": "Scroll a stable list and wait for app-owned visible/settled evidence.",
  "journey": {
    "name": "Scroll and settle list",
    "intent": "Move a stable list and prove visible content reached a settled state.",
    "actor": "app user",
    "startState": "list visible and idle",
    "endState": "list content settled after scroll"
  },
  "platforms": ["ios", "android"],
  "requiredCapabilities": ["launch", "sessionControl", "command", "logCapture", "artifactWrite"],
  "optionalCapabilities": ["screenshot", "video", "uiTree", "profiler"],
  "truthEvents": {
    "scrollStarted": {
      "event": "list_scroll_started",
      "required": true,
      "phase": "intent"
    },
    "settled": {
      "event": "list_scroll_settled",
      "required": true,
      "timeoutMs": 3000,
      "phase": "visual"
    }
  },
  "milestones": [
    {
      "id": "scrollStarted",
      "event": "list_scroll_started",
      "description": "The list scroll interaction started.",
      "required": true,
      "phase": "intent"
    },
    {
      "id": "settled",
      "event": "list_scroll_settled",
      "description": "The app observed stable visible content after scrolling.",
      "required": true,
      "timeoutMs": 3000,
      "phase": "visual"
    }
  ],
  "expectedEvents": [
    "list_scroll_started",
    "list_scroll_settled"
  ],
  "cycles": {
    "iterations": 3,
    "warmupIterations": 0,
    "stopOnFailure": true
  },
  "budgets": [
    {
      "name": "scroll settle p95",
      "source": "milestone",
      "metric": "p95",
      "unit": "ms",
      "limit": 1400,
      "fromMilestone": "scrollStarted",
      "toMilestone": "settled"
    },
    {
      "name": "dropped frames",
      "source": "artifact",
      "metric": "droppedFrames",
      "unit": "count",
      "limit": 0,
      "artifact": "profiler"
    }
  ],
  "steps": [
    {
      "id": "launch",
      "kind": "launch"
    },
    {
      "id": "scroll-list",
      "kind": "command",
      "command": "scroll-by:600",
      "adapterOptions": {
        "gestureFallback": {
          "direction": "down"
        }
      }
    },
    {
      "id": "wait-settled",
      "kind": "waitForMilestone",
      "milestone": "settled",
      "timeoutMs": 3000
    },
    {
      "id": "capture-ui-tree",
      "kind": "captureEvidence",
      "artifact": "uiTree",
      "required": false
    }
  ],
  "artifacts": {
    "required": ["logs", "signals"],
    "optional": ["screenshot", "video", "uiTree", "profiler"]
  }
}
