{
  "schemaVersion": "1.0.0",
  "id": "app-startup",
  "flowId": "startup",
  "description": "Launch the app and wait for the first usable screen milestone.",
  "journey": {
    "name": "App startup",
    "intent": "Open the app from a cold state and prove the first usable screen is ready.",
    "actor": "returning user",
    "startState": "app not running",
    "endState": "first usable screen visible"
  },
  "platforms": ["ios", "android"],
  "requiredCapabilities": ["launch", "sessionControl", "logCapture", "artifactWrite"],
  "optionalCapabilities": ["screenshot", "video"],
  "truthEvents": {
    "firstUsable": {
      "event": "app_first_usable_screen",
      "required": true,
      "timeoutMs": 8000,
      "phase": "visual"
    }
  },
  "milestones": [
    {
      "id": "firstUsable",
      "event": "app_first_usable_screen",
      "description": "The first app-owned screen is visible and usable.",
      "required": true,
      "timeoutMs": 8000,
      "phase": "visual"
    }
  ],
  "expectedEvents": ["app_first_usable_screen"],
  "cycles": {
    "iterations": 1,
    "warmupIterations": 0,
    "stopOnFailure": true
  },
  "budgets": [
    {
      "name": "startup first usable p95",
      "source": "milestone",
      "metric": "p95",
      "unit": "ms",
      "limit": 8000,
      "toMilestone": "firstUsable"
    }
  ],
  "steps": [
    {
      "id": "launch",
      "kind": "launch"
    },
    {
      "id": "wait-for-first-usable",
      "kind": "waitForMilestone",
      "milestone": "firstUsable",
      "timeoutMs": 8000
    },
    {
      "id": "capture-final-screen",
      "kind": "captureEvidence",
      "artifact": "screenshot",
      "required": false
    }
  ],
  "artifacts": {
    "required": ["logs", "signals"],
    "optional": ["screenshot", "video"]
  }
}
