{
  "schemaVersion": "1.0.0",
  "id": "media-open-close",
  "flowId": "media-open-close",
  "description": "Open media, wait for visual readiness, then dismiss cleanly.",
  "journey": {
    "name": "Open and dismiss media",
    "intent": "Open a media surface, prove visual readiness, then dismiss it cleanly.",
    "actor": "app user",
    "startState": "media entry point visible",
    "endState": "media surface dismissed"
  },
  "platforms": ["ios", "android"],
  "requiredCapabilities": ["launch", "sessionControl", "command", "logCapture", "artifactWrite"],
  "optionalCapabilities": ["screenshot", "video", "memory", "network"],
  "truthEvents": {
    "openRequested": {
      "event": "media_open_requested",
      "required": true,
      "phase": "intent"
    },
    "mediaReady": {
      "event": "media_visual_ready",
      "required": true,
      "timeoutMs": 5000,
      "phase": "visual"
    },
    "closeRequested": {
      "event": "media_close_requested",
      "required": true,
      "phase": "intent"
    },
    "dismissed": {
      "event": "media_dismissed",
      "required": true,
      "timeoutMs": 3000,
      "phase": "completion"
    }
  },
  "milestones": [
    {
      "id": "openRequested",
      "event": "media_open_requested",
      "description": "The app received the command to open media.",
      "required": true,
      "phase": "intent"
    },
    {
      "id": "mediaReady",
      "event": "media_visual_ready",
      "description": "The media surface is visually ready.",
      "required": true,
      "timeoutMs": 5000,
      "phase": "visual"
    },
    {
      "id": "closeRequested",
      "event": "media_close_requested",
      "description": "The app received the command to dismiss media.",
      "required": true,
      "phase": "intent"
    },
    {
      "id": "dismissed",
      "event": "media_dismissed",
      "description": "The media surface was dismissed cleanly.",
      "required": true,
      "timeoutMs": 3000,
      "phase": "completion"
    }
  ],
  "expectedEvents": [
    "media_open_requested",
    "media_visual_ready",
    "media_close_requested",
    "media_dismissed"
  ],
  "cycles": {
    "iterations": 3,
    "warmupIterations": 0,
    "stopOnFailure": true
  },
  "budgets": [
    {
      "name": "media ready p95",
      "source": "milestone",
      "metric": "p95",
      "unit": "ms",
      "limit": 5000,
      "fromMilestone": "openRequested",
      "toMilestone": "mediaReady"
    },
    {
      "name": "dismiss p95",
      "source": "milestone",
      "metric": "p95",
      "unit": "ms",
      "limit": 3000,
      "fromMilestone": "closeRequested",
      "toMilestone": "dismissed"
    }
  ],
  "steps": [
    {
      "id": "launch",
      "kind": "launch"
    },
    {
      "id": "open-media",
      "kind": "command",
      "command": "activate-target:example-media-open"
    },
    {
      "id": "wait-media-ready",
      "kind": "waitForMilestone",
      "milestone": "mediaReady",
      "timeoutMs": 5000
    },
    {
      "id": "capture-media",
      "kind": "captureEvidence",
      "artifact": "screenshot",
      "required": false
    },
    {
      "id": "close-media",
      "kind": "command",
      "command": "activate-target:example-media-close"
    },
    {
      "id": "wait-dismissed",
      "kind": "waitForMilestone",
      "milestone": "dismissed",
      "timeoutMs": 3000
    }
  ],
  "artifacts": {
    "required": ["logs", "signals"],
    "optional": ["screenshot", "video", "memory", "network"]
  }
}
